{
  "v": 1,
  "agent": "smoke-agent",
  "updated": "2026-09-17",
  "phase": "NEED_AGENT",
  "current": ["Run deterministic echo smoke."],
  "verified": [],
  "unresolved": [],
  "fault_boundary": "unknown",
  "active_task": null,
  "active_action": null,
  "last_result": null,
  "next_reads": ["examples/echo/action.json"],
  "next_action": "Prepare echo action.",
  "writeback_reason": "bootstrap example"
}
