{
  "v": 1,
  "agent": "chatgpt",
  "updated": "UNCONFIGURED",
  "phase": "IDLE",
  "current": [],
  "verified": [],
  "unresolved": [],
  "active_task": null,
  "active_action": null,
  "active_dispatch_ref": null,
  "handoff_packet_ref": null,
  "fault_boundary": "none",
  "last_result": null,
  "next_reads": [],
  "next_action": "Complete installation before assigning work.",
  "control_request": null,
  "writeback_reason": "clean-template"
}
